{
  "schema_version": 1,
  "allowlist_version": "publication-exports-v3",
  "exports": [
    {
      "export_name": "dim_public_organizations",
      "export_class": "named_history",
      "source_relation": "dim_public_organizations",
      "columns": [
        "state_charity_registration_number",
        "organization_name",
        "city",
        "state",
        "latest_source_reported_status",
        "latest_observed_as_of_date",
        "latest_observed_release_revision",
        "official_verification_instructions",
        "latest_release_observation_state"
      ],
      "grain": [
        "state_charity_registration_number"
      ],
      "measures": [],
      "file_name": "dim_public_organizations.csv",
      "dialect": "calico-csv-v1"
    },
    {
      "export_name": "fct_public_status_observations",
      "export_class": "named_history",
      "source_relation": "fct_public_status_observations",
      "columns": [
        "state_charity_registration_number",
        "as_of_date",
        "release_revision",
        "observation_state",
        "source_reported_status"
      ],
      "grain": [
        "state_charity_registration_number",
        "as_of_date",
        "release_revision"
      ],
      "measures": [],
      "file_name": "fct_public_status_observations.csv",
      "dialect": "calico-csv-v1"
    },
    {
      "export_name": "mart_adjacent_pair_metrics",
      "export_class": "aggregate",
      "source_relation": "mart_adjacent_pair_metrics",
      "columns": [
        "from_as_of_date",
        "from_release_revision",
        "from_revision_fingerprint",
        "to_as_of_date",
        "to_release_revision",
        "to_revision_fingerprint",
        "gap_days",
        "starting_delinquent_count",
        "ending_published_delinquent_count",
        "observed_exit_count",
        "still_delinquent_count",
        "not_observed_count",
        "matched_observed_entry_count",
        "newly_observed_delinquent_count",
        "total_entrant_count",
        "net_delinquent_movement",
        "observed_exit_denominator_id",
        "observed_exit_proportion",
        "largest_transition_from_status",
        "largest_transition_to_status",
        "largest_transition_count",
        "matched_entry_denominator_id",
        "total_entrant_denominator_id",
        "observed_exit_wilson_95_lower",
        "observed_exit_wilson_95_upper"
      ],
      "grain": [
        "from_as_of_date",
        "from_release_revision",
        "from_revision_fingerprint",
        "to_as_of_date",
        "to_release_revision",
        "to_revision_fingerprint"
      ],
      "measures": [
        "gap_days",
        "starting_delinquent_count",
        "ending_published_delinquent_count",
        "observed_exit_count",
        "still_delinquent_count",
        "not_observed_count",
        "matched_observed_entry_count",
        "newly_observed_delinquent_count",
        "total_entrant_count",
        "net_delinquent_movement",
        "observed_exit_denominator_id",
        "observed_exit_proportion",
        "largest_transition_from_status",
        "largest_transition_to_status",
        "largest_transition_count",
        "matched_entry_denominator_id",
        "total_entrant_denominator_id",
        "observed_exit_wilson_95_lower",
        "observed_exit_wilson_95_upper"
      ],
      "file_name": "mart_adjacent_pair_metrics.csv",
      "dialect": "calico-csv-v1"
    },
    {
      "export_name": "mart_claim_support",
      "export_class": "aggregate",
      "source_relation": "mart_claim_support",
      "columns": [
        "claim_support_version",
        "from_as_of_date",
        "from_release_revision",
        "from_revision_fingerprint",
        "to_as_of_date",
        "to_release_revision",
        "to_revision_fingerprint",
        "gap_days",
        "matched_start_status",
        "matched_end_population",
        "support_count",
        "support_denominator_count",
        "support_denominator_id",
        "support_share_of_matched_entries",
        "total_matched_entry_count",
        "matched_entry_denominator_id",
        "total_entrant_count",
        "total_entrant_denominator_id",
        "dominant_source_reported_status_date",
        "dominant_status_date_count",
        "dominant_status_date_denominator_count",
        "dominant_status_date_denominator_id",
        "dominant_status_date_share",
        "next_from_as_of_date",
        "next_to_as_of_date",
        "next_gap_days",
        "next_total_matched_entry_count"
      ],
      "grain": [
        "from_as_of_date",
        "from_release_revision",
        "from_revision_fingerprint",
        "to_as_of_date",
        "to_release_revision",
        "to_revision_fingerprint"
      ],
      "measures": [
        "claim_support_version",
        "gap_days",
        "matched_start_status",
        "matched_end_population",
        "support_count",
        "support_denominator_count",
        "support_denominator_id",
        "support_share_of_matched_entries",
        "total_matched_entry_count",
        "matched_entry_denominator_id",
        "total_entrant_count",
        "total_entrant_denominator_id",
        "dominant_source_reported_status_date",
        "dominant_status_date_count",
        "dominant_status_date_denominator_count",
        "dominant_status_date_denominator_id",
        "dominant_status_date_share",
        "next_from_as_of_date",
        "next_to_as_of_date",
        "next_gap_days",
        "next_total_matched_entry_count"
      ],
      "file_name": "mart_claim_support.csv",
      "dialect": "calico-csv-v1"
    },
    {
      "export_name": "mart_last_renewal_diagnostic",
      "export_class": "aggregate",
      "source_relation": "mart_last_renewal_diagnostic",
      "columns": [
        "from_as_of_date",
        "from_release_revision",
        "from_revision_fingerprint",
        "to_as_of_date",
        "to_release_revision",
        "to_revision_fingerprint",
        "gap_days",
        "diagnostic_role",
        "measure_name",
        "denominator_definition_id",
        "diagnostic_eligible_count",
        "numerator_count",
        "denominator_count",
        "measure_value",
        "wilson_95_lower",
        "wilson_95_upper"
      ],
      "grain": [
        "from_as_of_date",
        "from_release_revision",
        "from_revision_fingerprint",
        "to_as_of_date",
        "to_release_revision",
        "to_revision_fingerprint",
        "measure_name"
      ],
      "measures": [
        "gap_days",
        "diagnostic_role",
        "denominator_definition_id",
        "diagnostic_eligible_count",
        "numerator_count",
        "denominator_count",
        "measure_value",
        "wilson_95_lower",
        "wilson_95_upper"
      ],
      "file_name": "mart_last_renewal_diagnostic.csv",
      "dialect": "calico-csv-v1"
    },
    {
      "export_name": "mart_publication_status",
      "export_class": "aggregate",
      "source_relation": "mart_publication_status",
      "columns": [
        "published_as_of_date",
        "published_release_revision"
      ],
      "grain": [
        "published_as_of_date"
      ],
      "measures": [
        "published_release_revision"
      ],
      "file_name": "mart_publication_status.csv",
      "dialect": "calico-csv-v1"
    },
    {
      "export_name": "mart_registry_population_coverage",
      "export_class": "aggregate",
      "source_relation": "mart_registry_population_coverage",
      "columns": [
        "as_of_date",
        "release_revision",
        "revision_fingerprint",
        "source_list",
        "source_reported_registry_status",
        "coverage_class",
        "record_count"
      ],
      "grain": [
        "as_of_date",
        "release_revision",
        "revision_fingerprint",
        "source_list",
        "source_reported_registry_status",
        "coverage_class"
      ],
      "measures": [
        "record_count"
      ],
      "file_name": "mart_registry_population_coverage.csv",
      "dialect": "calico-csv-v1"
    },
    {
      "export_name": "mart_release_quality",
      "export_class": "aggregate",
      "source_relation": "mart_release_quality",
      "columns": [
        "as_of_date",
        "release_revision",
        "revision_fingerprint",
        "parser_contract_version",
        "release_health_state",
        "release_flag_count",
        "release_flag_pass_count",
        "release_flag_review_count",
        "release_flag_rule_versions",
        "schema_added_column_count",
        "schema_removed_column_count",
        "schema_type_changed_column_count",
        "schema_contract_version",
        "capture_attempted_count",
        "capture_succeeded_count",
        "capture_failed_count",
        "capture_unavailable_count"
      ],
      "grain": [
        "as_of_date",
        "release_revision",
        "revision_fingerprint"
      ],
      "measures": [
        "parser_contract_version",
        "release_health_state",
        "release_flag_count",
        "release_flag_pass_count",
        "release_flag_review_count",
        "release_flag_rule_versions",
        "schema_added_column_count",
        "schema_removed_column_count",
        "schema_type_changed_column_count",
        "schema_contract_version",
        "capture_attempted_count",
        "capture_succeeded_count",
        "capture_failed_count",
        "capture_unavailable_count"
      ],
      "file_name": "mart_release_quality.csv",
      "dialect": "calico-csv-v1"
    },
    {
      "export_name": "mart_release_snapshot_metrics",
      "export_class": "aggregate",
      "source_relation": "mart_release_snapshot_metrics",
      "columns": [
        "as_of_date",
        "release_revision",
        "revision_fingerprint",
        "parser_contract_version",
        "published_delinquent_category",
        "published_delinquent_category_count",
        "keyed_record_count",
        "unkeyed_record_count",